[
  {
    "id": "recruit_hp_growth",
    "name": "Hardy Recruits",
    "description": "+5% HP growth per tier",
    "category": "recruit_stats",
    "maxLevel": 5,
    "costs": [75, 100, 150, 225, 350],
    "effects": [
      { "recruitGrowth": "HP", "growthValue": 5 },
      { "recruitGrowth": "HP", "growthValue": 10 },
      { "recruitGrowth": "HP", "growthValue": 15 },
      { "recruitGrowth": "HP", "growthValue": 20 },
      { "recruitGrowth": "HP", "growthValue": 25 }
    ]
  },
  {
    "id": "recruit_str_growth",
    "name": "Strong Arms",
    "description": "+5% STR growth per tier",
    "category": "recruit_stats",
    "maxLevel": 5,
    "costs": [75, 125, 175, 275, 425],
    "effects": [
      { "recruitGrowth": "STR", "growthValue": 5 },
      { "recruitGrowth": "STR", "growthValue": 10 },
      { "recruitGrowth": "STR", "growthValue": 15 },
      { "recruitGrowth": "STR", "growthValue": 20 },
      { "recruitGrowth": "STR", "growthValue": 25 }
    ]
  },
  {
    "id": "recruit_def_growth",
    "name": "Tough Recruits",
    "description": "+5% DEF growth per tier",
    "category": "recruit_stats",
    "maxLevel": 5,
    "costs": [75, 125, 175, 275, 425],
    "effects": [
      { "recruitGrowth": "DEF", "growthValue": 5 },
      { "recruitGrowth": "DEF", "growthValue": 10 },
      { "recruitGrowth": "DEF", "growthValue": 15 },
      { "recruitGrowth": "DEF", "growthValue": 20 },
      { "recruitGrowth": "DEF", "growthValue": 25 }
    ]
  },
  {
    "id": "recruit_spd_growth",
    "name": "Quick Feet",
    "description": "+5% SPD growth per tier",
    "category": "recruit_stats",
    "maxLevel": 5,
    "costs": [75, 125, 200, 300, 450],
    "effects": [
      { "recruitGrowth": "SPD", "growthValue": 5 },
      { "recruitGrowth": "SPD", "growthValue": 10 },
      { "recruitGrowth": "SPD", "growthValue": 15 },
      { "recruitGrowth": "SPD", "growthValue": 20 },
      { "recruitGrowth": "SPD", "growthValue": 25 }
    ]
  },
  {
    "id": "recruit_skl_growth",
    "name": "Sharp Eye",
    "description": "+5% SKL growth per tier",
    "category": "recruit_stats",
    "maxLevel": 5,
    "costs": [75, 100, 150, 225, 350],
    "effects": [
      { "recruitGrowth": "SKL", "growthValue": 5 },
      { "recruitGrowth": "SKL", "growthValue": 10 },
      { "recruitGrowth": "SKL", "growthValue": 15 },
      { "recruitGrowth": "SKL", "growthValue": 20 },
      { "recruitGrowth": "SKL", "growthValue": 25 }
    ]
  },
  {
    "id": "recruit_res_growth",
    "name": "Warded Recruits",
    "description": "+5% RES growth per tier",
    "category": "recruit_stats",
    "maxLevel": 5,
    "costs": [75, 100, 125, 200, 300],
    "effects": [
      { "recruitGrowth": "RES", "growthValue": 5 },
      { "recruitGrowth": "RES", "growthValue": 10 },
      { "recruitGrowth": "RES", "growthValue": 15 },
      { "recruitGrowth": "RES", "growthValue": 20 },
      { "recruitGrowth": "RES", "growthValue": 25 }
    ]
  },
  {
    "id": "recruit_hp_flat",
    "name": "Recruit Vitality",
    "description": "+HP for recruits",
    "category": "recruit_stats",
    "maxLevel": 3,
    "costs": [200, 500, 1000],
    "requires": { "upgrades": [{ "id": "recruit_hp_growth", "level": 3 }] },
    "effects": [
      { "stat": "HP", "value": 2 },
      { "stat": "HP", "value": 5 },
      { "stat": "HP", "value": 10 }
    ]
  },
  {
    "id": "recruit_str_flat",
    "name": "Recruit Brawn",
    "description": "+STR for recruits",
    "category": "recruit_stats",
    "maxLevel": 3,
    "costs": [250, 600, 1200],
    "requires": { "upgrades": [{ "id": "recruit_str_growth", "level": 3 }] },
    "effects": [
      { "stat": "STR", "value": 1 },
      { "stat": "STR", "value": 3 },
      { "stat": "STR", "value": 5 }
    ]
  },
  {
    "id": "recruit_def_flat",
    "name": "Recruit Armor",
    "description": "+DEF for recruits",
    "category": "recruit_stats",
    "maxLevel": 3,
    "costs": [250, 600, 1200],
    "requires": { "upgrades": [{ "id": "recruit_def_growth", "level": 3 }] },
    "effects": [
      { "stat": "DEF", "value": 1 },
      { "stat": "DEF", "value": 3 },
      { "stat": "DEF", "value": 5 }
    ]
  },
  {
    "id": "recruit_spd_flat",
    "name": "Recruit Agility",
    "description": "+SPD for recruits",
    "category": "recruit_stats",
    "maxLevel": 3,
    "costs": [250, 650, 1400],
    "requires": { "upgrades": [{ "id": "recruit_spd_growth", "level": 3 }] },
    "effects": [
      { "stat": "SPD", "value": 1 },
      { "stat": "SPD", "value": 3 },
      { "stat": "SPD", "value": 5 }
    ]
  },
  {
    "id": "recruit_skl_flat",
    "name": "Recruit Precision",
    "description": "+SKL for recruits",
    "category": "recruit_stats",
    "maxLevel": 3,
    "costs": [200, 450, 900],
    "requires": { "upgrades": [{ "id": "recruit_skl_growth", "level": 3 }] },
    "effects": [
      { "stat": "SKL", "value": 1 },
      { "stat": "SKL", "value": 3 },
      { "stat": "SKL", "value": 5 }
    ]
  },
  {
    "id": "recruit_res_flat",
    "name": "Recruit Ward",
    "description": "+RES for recruits",
    "category": "recruit_stats",
    "maxLevel": 3,
    "costs": [200, 400, 800],
    "requires": { "upgrades": [{ "id": "recruit_res_growth", "level": 3 }] },
    "effects": [
      { "stat": "RES", "value": 1 },
      { "stat": "RES", "value": 3 },
      { "stat": "RES", "value": 5 }
    ]
  },
  {
    "id": "lord_hp_growth",
    "name": "Lord Vitality",
    "description": "+5% HP growth per tier",
    "category": "lord_bonuses",
    "maxLevel": 5,
    "costs": [100, 150, 200, 300, 450],
    "effects": [
      { "lordGrowth": "HP", "growthValue": 5 },
      { "lordGrowth": "HP", "growthValue": 10 },
      { "lordGrowth": "HP", "growthValue": 15 },
      { "lordGrowth": "HP", "growthValue": 20 },
      { "lordGrowth": "HP", "growthValue": 25 }
    ]
  },
  {
    "id": "lord_str_growth",
    "name": "Lord Combat Training",
    "description": "+5% STR growth per tier",
    "category": "lord_bonuses",
    "maxLevel": 5,
    "costs": [100, 175, 250, 375, 550],
    "effects": [
      { "lordGrowth": "STR", "growthValue": 5 },
      { "lordGrowth": "STR", "growthValue": 10 },
      { "lordGrowth": "STR", "growthValue": 15 },
      { "lordGrowth": "STR", "growthValue": 20 },
      { "lordGrowth": "STR", "growthValue": 25 }
    ]
  },
  {
    "id": "lord_def_growth",
    "name": "Lord Resilience",
    "description": "+5% DEF growth per tier",
    "category": "lord_bonuses",
    "maxLevel": 5,
    "costs": [100, 175, 250, 375, 550],
    "effects": [
      { "lordGrowth": "DEF", "growthValue": 5 },
      { "lordGrowth": "DEF", "growthValue": 10 },
      { "lordGrowth": "DEF", "growthValue": 15 },
      { "lordGrowth": "DEF", "growthValue": 20 },
      { "lordGrowth": "DEF", "growthValue": 25 }
    ]
  },
  {
    "id": "lord_spd_growth",
    "name": "Lord Swiftness",
    "description": "+5% SPD growth per tier",
    "category": "lord_bonuses",
    "maxLevel": 5,
    "costs": [100, 175, 275, 400, 600],
    "effects": [
      { "lordGrowth": "SPD", "growthValue": 5 },
      { "lordGrowth": "SPD", "growthValue": 10 },
      { "lordGrowth": "SPD", "growthValue": 15 },
      { "lordGrowth": "SPD", "growthValue": 20 },
      { "lordGrowth": "SPD", "growthValue": 25 }
    ]
  },
  {
    "id": "lord_res_growth",
    "name": "Lord Wisdom",
    "description": "+5% RES growth per tier",
    "category": "lord_bonuses",
    "maxLevel": 5,
    "costs": [100, 150, 200, 300, 450],
    "effects": [
      { "lordGrowth": "RES", "growthValue": 5 },
      { "lordGrowth": "RES", "growthValue": 10 },
      { "lordGrowth": "RES", "growthValue": 15 },
      { "lordGrowth": "RES", "growthValue": 20 },
      { "lordGrowth": "RES", "growthValue": 25 }
    ]
  },
  {
    "id": "lord_hp_flat",
    "name": "Lord Constitution",
    "description": "+HP for lords",
    "category": "lord_bonuses",
    "maxLevel": 3,
    "costs": [300, 650, 1300],
    "requires": {
      "upgrades": [{ "id": "lord_hp_growth", "level": 3 }],
      "milestones": ["beatAct1"]
    },
    "effects": [
      { "lordStat": "HP", "value": 2 },
      { "lordStat": "HP", "value": 5 },
      { "lordStat": "HP", "value": 10 }
    ]
  },
  {
    "id": "lord_str_flat",
    "name": "Lord Might",
    "description": "+STR for lords",
    "category": "lord_bonuses",
    "maxLevel": 3,
    "costs": [300, 700, 1500],
    "requires": {
      "upgrades": [{ "id": "lord_str_growth", "level": 3 }],
      "milestones": ["beatAct1"]
    },
    "effects": [
      { "lordStat": "STR", "value": 1 },
      { "lordStat": "STR", "value": 3 },
      { "lordStat": "STR", "value": 5 }
    ]
  },
  {
    "id": "lord_def_flat",
    "name": "Lord Fortitude",
    "description": "+DEF for lords",
    "category": "lord_bonuses",
    "maxLevel": 3,
    "costs": [300, 700, 1500],
    "requires": {
      "upgrades": [{ "id": "lord_def_growth", "level": 3 }],
      "milestones": ["beatAct1"]
    },
    "effects": [
      { "lordStat": "DEF", "value": 1 },
      { "lordStat": "DEF", "value": 3 },
      { "lordStat": "DEF", "value": 5 }
    ]
  },
  {
    "id": "lord_spd_flat",
    "name": "Lord Celerity",
    "description": "+SPD for lords",
    "category": "lord_bonuses",
    "maxLevel": 3,
    "costs": [300, 750, 1600],
    "requires": {
      "upgrades": [{ "id": "lord_spd_growth", "level": 3 }],
      "milestones": ["beatAct1"]
    },
    "effects": [
      { "lordStat": "SPD", "value": 1 },
      { "lordStat": "SPD", "value": 3 },
      { "lordStat": "SPD", "value": 5 }
    ]
  },
  {
    "id": "lord_res_flat",
    "name": "Lord Warding",
    "description": "+RES for lords",
    "category": "lord_bonuses",
    "maxLevel": 3,
    "costs": [300, 600, 1100],
    "requires": { "upgrades": [{ "id": "lord_res_growth", "level": 3 }] },
    "effects": [
      { "lordStat": "RES", "value": 1 },
      { "lordStat": "RES", "value": 3 },
      { "lordStat": "RES", "value": 5 }
    ]
  },
  {
    "id": "starting_gold",
    "name": "War Chest",